{
  "$schema": "https://erdesigns.eu/schema/service-routines.json",
  "schema_version": 1,
  "description": "Workshop service routine catalog. Add OEM-specific routines here without recompiling.",
  "categories": [
    "maintenance",
    "steering_brakes",
    "powertrain",
    "comfort",
    "battery_electrical",
    "tpms",
    "emissions"
  ],
  "safety_levels": [
    "none",
    "engine_must_be_running",
    "engine_must_be_off",
    "vehicle_must_be_stationary",
    "vehicle_may_move",
    "battery_min_12v5",
    "requires_workshop_login"
  ],
  "fields": {
    "key": "Stable identifier, lower-case",
    "display_name": "Shown in UIs",
    "category": "One of the categories listed above",
    "applicability": "Comma-separated OEM keys, or 'all'",
    "routine_identifier": "UDS 0x31 RoutineControl Identifier (RID), 0xHEX",
    "sub_function": "0x01=Start 0x02=Stop 0x03=ResultRead",
    "option_record_hex": "Optional bytes appended after RID, '' if unused",
    "required_session_type": "0x01=Default 0x02=Programming 0x03=Extended ...",
    "safety": "One of the safety levels listed above",
    "pre_conditions": "Free-form prose",
    "post_conditions": "Free-form prose",
    "citation": "Public reference (URL or document ID); never empty"
  },
  "entries": [
    {
      "key": "oil_reset_vag",
      "display_name": "Oil Service Reset (VAG SRI)",
      "category": "maintenance",
      "applicability": "vw,audi,seat,skoda",
      "routine_identifier": "0x0301",
      "sub_function": "0x01",
      "option_record_hex": "",
      "required_session_type": "0x03",
      "safety": "engine_must_be_off",
      "pre_conditions": "Engine off, ignition on, doors closed.",
      "post_conditions": "Verify SRI shows full distance to next service.",
      "citation": "VW Service Manual + Ross-Tech wiki / SRI Reset."
    },
    {
      "key": "oil_reset_bmw",
      "display_name": "Oil Service Reset (BMW CBS)",
      "category": "maintenance",
      "applicability": "bmw,mini",
      "routine_identifier": "0xF062",
      "sub_function": "0x01",
      "option_record_hex": "",
      "required_session_type": "0x03",
      "safety": "engine_must_be_off",
      "pre_conditions": "Engine off, ignition on, key in.",
      "post_conditions": "CBS shows next service in km/months and oil-life 100%.",
      "citation": "BMW TIS + BimmerCode/Carly public archives."
    },
    {
      "key": "oil_reset_mb",
      "display_name": "Oil Service Reset (Mercedes ASSYST)",
      "category": "maintenance",
      "applicability": "mercedes",
      "routine_identifier": "0x5028",
      "sub_function": "0x01",
      "option_record_hex": "",
      "required_session_type": "0x03",
      "safety": "engine_must_be_off",
      "pre_conditions": "Engine off, ignition on, doors closed.",
      "post_conditions": "ASSYST PLUS shows full service interval.",
      "citation": "Mercedes WIS / ASSYST Plus reset procedure."
    },
    {
      "key": "oil_reset_ford",
      "display_name": "Oil Life Reset (Ford OLM)",
      "category": "maintenance",
      "applicability": "ford,lincoln",
      "routine_identifier": "0x0301",
      "sub_function": "0x01",
      "option_record_hex": "",
      "required_session_type": "0x03",
      "safety": "engine_must_be_off",
      "pre_conditions": "Engine off, ignition on.",
      "post_conditions": "Cluster shows OLM reset; remaining oil life 100%.",
      "citation": "Ford TSB + FORScan archives."
    },
    {
      "key": "oil_reset_toyota",
      "display_name": "Maintenance Reset (Toyota MAINT)",
      "category": "maintenance",
      "applicability": "toyota,lexus",
      "routine_identifier": "0x0301",
      "sub_function": "0x01",
      "option_record_hex": "",
      "required_session_type": "0x03",
      "safety": "engine_must_be_off",
      "pre_conditions": "Engine off, ignition on, odometer mode.",
      "post_conditions": "Maintenance light off; cycle reset.",
      "citation": "Toyota Repair Manual + Techstream service."
    },
    {
      "key": "adblue_level_reset",
      "display_name": "AdBlue / DEF Level Reset",
      "category": "maintenance",
      "applicability": "vw,audi,bmw,mercedes,ford",
      "routine_identifier": "0x0306",
      "sub_function": "0x01",
      "option_record_hex": "",
      "required_session_type": "0x03",
      "safety": "vehicle_must_be_stationary",
      "pre_conditions": "Vehicle stationary; tank refilled.",
      "post_conditions": "AdBlue range counter resets to full.",
      "citation": "OEM diesel emission service docs."
    },
    {
      "key": "sas_zero",
      "display_name": "Steering Angle Sensor Calibration",
      "category": "steering_brakes",
      "applicability": "vw,audi,bmw,mercedes,ford,toyota,honda,hyundai,kia",
      "routine_identifier": "0x0301",
      "sub_function": "0x01",
      "option_record_hex": "",
      "required_session_type": "0x03",
      "safety": "vehicle_must_be_stationary",
      "pre_conditions": "Wheels straight, vehicle stationary, ignition on.",
      "post_conditions": "SAS reads 0.0 degrees; no DTC.",
      "citation": "ISO 26262 + per-OEM TSBs (e.g. VW Self Study Programs)."
    },
    {
      "key": "epb_service_mode_open",
      "display_name": "Electric Park Brake — Service Mode (Open)",
      "category": "steering_brakes",
      "applicability": "vw,audi,bmw,mercedes,ford,volvo",
      "routine_identifier": "0x0307",
      "sub_function": "0x01",
      "option_record_hex": "",
      "required_session_type": "0x03",
      "safety": "vehicle_may_move",
      "pre_conditions": "Vehicle stationary, transmission in P/N, hood open per OEM.",
      "post_conditions": "Calipers retract; service indicator on cluster.",
      "citation": "OEM service info + EPB unwind TSBs."
    },
    {
      "key": "epb_service_mode_close",
      "display_name": "Electric Park Brake — Service Mode (Close)",
      "category": "steering_brakes",
      "applicability": "vw,audi,bmw,mercedes,ford,volvo",
      "routine_identifier": "0x0307",
      "sub_function": "0x02",
      "option_record_hex": "",
      "required_session_type": "0x03",
      "safety": "vehicle_may_move",
      "pre_conditions": "Brake pads installed, calipers ready.",
      "post_conditions": "Calipers torque to pads; EPB ready.",
      "citation": "OEM service info + EPB unwind TSBs."
    },
    {
      "key": "abs_bleed_4wheel",
      "display_name": "ABS Hydraulic Bleed (4-wheel)",
      "category": "steering_brakes",
      "applicability": "vw,audi,bmw,mercedes,ford,toyota",
      "routine_identifier": "0x0303",
      "sub_function": "0x01",
      "option_record_hex": "",
      "required_session_type": "0x03",
      "safety": "vehicle_must_be_stationary",
      "pre_conditions": "Brake fluid topped, ignition on, scan tool sequencing wheels.",
      "post_conditions": "No air in lines; pedal feel firm.",
      "citation": "OEM service info + Bosch ABS docs."
    },
    {
      "key": "dpf_forced_regen",
      "display_name": "DPF Forced Regeneration",
      "category": "powertrain",
      "applicability": "vw,audi,bmw,mercedes,ford,volvo,renault",
      "routine_identifier": "0x0309",
      "sub_function": "0x01",
      "option_record_hex": "",
      "required_session_type": "0x03",
      "safety": "engine_must_be_running",
      "pre_conditions": "Engine warm (>80C), fuel >25%, no DPF DTCs blocking, vehicle parked outdoors.",
      "post_conditions": "Soot mass < threshold; differential pressure normal.",
      "citation": "OEM diesel service info; DPF Forced Regen TSBs."
    },
    {
      "key": "throttle_body_adapt",
      "display_name": "Throttle Body Adaptation",
      "category": "powertrain",
      "applicability": "vw,audi,seat,skoda",
      "routine_identifier": "0x0335",
      "sub_function": "0x01",
      "option_record_hex": "",
      "required_session_type": "0x03",
      "safety": "engine_must_be_off",
      "pre_conditions": "Engine off, ignition on, all loads off.",
      "post_conditions": "Throttle adaptation values within range; idle stable after start.",
      "citation": "Ross-Tech wiki / Throttle Body Alignment."
    },
    {
      "key": "idle_relearn",
      "display_name": "Idle Air Volume Relearn",
      "category": "powertrain",
      "applicability": "nissan,infiniti",
      "routine_identifier": "0x0317",
      "sub_function": "0x01",
      "option_record_hex": "",
      "required_session_type": "0x03",
      "safety": "engine_must_be_running",
      "pre_conditions": "Engine warm, transmission in P/N, all loads off.",
      "post_conditions": "Idle stabilises within spec.",
      "citation": "Nissan FSM / NICOclub archives."
    },
    {
      "key": "window_pinch_learn_vag",
      "display_name": "Window Pinch Protection Learn",
      "category": "comfort",
      "applicability": "vw,audi,seat,skoda",
      "routine_identifier": "0x0341",
      "sub_function": "0x01",
      "option_record_hex": "",
      "required_session_type": "0x03",
      "safety": "vehicle_may_move",
      "pre_conditions": "All windows closed; ignition on; door closed.",
      "post_conditions": "One-touch up/down works; pinch protection re-armed.",
      "citation": "Ross-Tech wiki / 09 Cent Elec / Window Adaptation."
    },
    {
      "key": "sunroof_calibration",
      "display_name": "Sunroof Initialisation",
      "category": "comfort",
      "applicability": "vw,audi,bmw,mercedes",
      "routine_identifier": "0x0342",
      "sub_function": "0x01",
      "option_record_hex": "",
      "required_session_type": "0x03",
      "safety": "vehicle_may_move",
      "pre_conditions": "Sunroof at endpoint, ignition on.",
      "post_conditions": "Sunroof learns end-stops; pinch protection armed.",
      "citation": "OEM TSBs."
    },
    {
      "key": "seat_memory_reset",
      "display_name": "Seat Memory Module Reset",
      "category": "comfort",
      "applicability": "mercedes,bmw,audi",
      "routine_identifier": "0x0345",
      "sub_function": "0x02",